{
  "$schema": "https://json-schema.org/draft/2020-12/schema",
  "$id": "https://aios.dev/schemas/qualification-framework-payload.schema.json",
  "title": "AIOS Qualification Framework Payload",
  "description": "Qualification Framework payloads v0.10.0. Evaluate only. Never mutate framework. Benchmarks not executed in packaging.",
  "type": "object",
  "additionalProperties": false,
  "required": [
    "schema_version",
    "artifact_id",
    "type",
    "worker_id",
    "title",
    "summary",
    "entries",
    "status",
    "created_at"
  ],
  "properties": {
    "schema_version": {
      "$ref": "https://aios.dev/schemas/common.schema.json#/$defs/schemaVersion"
    },
    "artifact_id": {
      "$ref": "https://aios.dev/schemas/common.schema.json#/$defs/artifactId"
    },
    "type": {
      "type": "string",
      "enum": [
        "qualification-finding",
        "qualification-scores",
        "certification-report",
        "release-qualification-decision",
        "gate-qualification-report"
      ]
    },
    "worker_id": {
      "$ref": "https://aios.dev/schemas/common.schema.json#/$defs/kebabId"
    },
    "title": {
      "type": "string",
      "minLength": 1
    },
    "summary": {
      "type": "string",
      "minLength": 1
    },
    "entries": {
      "type": "array",
      "minItems": 1,
      "items": {
        "type": "object",
        "additionalProperties": false,
        "required": [
          "id",
          "entry_kind",
          "statement",
          "qualification_id",
          "target",
          "rule",
          "result",
          "evidence",
          "impact",
          "severity",
          "recommendation",
          "alternative_solution",
          "confidence",
          "source_paths",
          "unknowns",
          "traceability",
          "folder_mirror"
        ],
        "properties": {
          "id": {
            "type": "string",
            "minLength": 2
          },
          "entry_kind": {
            "type": "string",
            "minLength": 1
          },
          "statement": {
            "type": "string",
            "minLength": 1
          },
          "qualification_id": {
            "type": "string",
            "minLength": 1
          },
          "target": {
            "type": "string",
            "minLength": 1
          },
          "rule": {
            "type": "string",
            "minLength": 1
          },
          "result": {
            "type": "string",
            "enum": [
              "planned",
              "pass",
              "fail",
              "warn",
              "skip"
            ]
          },
          "evidence": {
            "type": "array",
            "items": {
              "type": "string"
            }
          },
          "impact": {
            "type": "string",
            "minLength": 1
          },
          "severity": {
            "$ref": "https://aios.dev/schemas/common.schema.json#/$defs/severity"
          },
          "recommendation": {
            "type": "string"
          },
          "alternative_solution": {
            "type": "string"
          },
          "confidence": {
            "type": "number",
            "minimum": 0,
            "maximum": 1
          },
          "source_paths": {
            "type": "array",
            "items": {
              "type": "string"
            }
          },
          "unknowns": {
            "type": "array",
            "items": {
              "type": "string"
            }
          },
          "traceability": {
            "type": "object"
          },
          "folder_mirror": {
            "type": "string",
            "minLength": 1
          },
          "metric_value": {
            "type": [
              "number",
              "null"
            ]
          },
          "threshold": {}
        }
      }
    },
    "status": {
      "$ref": "https://aios.dev/schemas/common.schema.json#/$defs/artifactStatus"
    },
    "created_at": {
      "type": "string",
      "format": "date-time"
    }
  }
}
